[
  {
    "name": "XGBClassifier",
    "model_name": "XGBClassifier",
    "task_type": "classification",
    "priority": 1,
    "rationale": "strong nonlinear tabular baseline",
    "selection_score": 44.0,
    "default_hyperparameters": {
      "n_estimators": 100,
      "max_depth": 6,
      "learning_rate": 0.3,
      "subsample": 1.0,
      "colsample_bytree": 1.0,
      "use_label_encoder": false,
      "eval_metric": "mlogloss",
      "random_state": 42,
      "n_jobs": -1,
      "verbosity": 0
    },
    "hp_space": {},
    "source": "model_library/ml_kit.py::MODEL_REGISTRY"
  },
  {
    "name": "HistGradientBoostingClassifier",
    "model_name": "HistGradientBoostingClassifier",
    "task_type": "classification",
    "priority": 2,
    "rationale": "efficient boosting baseline",
    "selection_score": 41.0,
    "default_hyperparameters": {
      "max_iter": 100,
      "learning_rate": 0.1,
      "max_depth": null,
      "random_state": 42
    },
    "hp_space": {},
    "source": "model_library/ml_kit.py::MODEL_REGISTRY"
  },
  {
    "name": "NuSVC",
    "model_name": "NuSVC",
    "task_type": "classification",
    "priority": 3,
    "rationale": "captures nonlinear boundaries; dataset size is suitable for kernel methods",
    "selection_score": 39.0,
    "default_hyperparameters": {
      "nu": 0.5,
      "kernel": "rbf",
      "gamma": "scale",
      "probability": true,
      "random_state": 42
    },
    "hp_space": {},
    "source": "model_library/ml_kit.py::MODEL_REGISTRY"
  },
  {
    "name": "RandomForestClassifier",
    "model_name": "RandomForestClassifier",
    "task_type": "classification",
    "priority": 4,
    "rationale": "robust ensemble baseline",
    "selection_score": 39.0,
    "default_hyperparameters": {
      "n_estimators": 100,
      "max_depth": null,
      "min_samples_split": 2,
      "random_state": 42,
      "n_jobs": -1
    },
    "hp_space": {},
    "source": "model_library/ml_kit.py::MODEL_REGISTRY"
  },
  {
    "name": "SVC",
    "model_name": "SVC",
    "task_type": "classification",
    "priority": 5,
    "rationale": "captures nonlinear boundaries; dataset size is suitable for kernel methods",
    "selection_score": 39.0,
    "default_hyperparameters": {
      "C": 1.0,
      "kernel": "rbf",
      "gamma": "scale",
      "probability": true,
      "random_state": 42
    },
    "hp_space": {},
    "source": "model_library/ml_kit.py::MODEL_REGISTRY"
  }
]
